{
  "groups": {
    "erc20": { "label": "ERC-20", "order": 99 }
  },
  "functions": {
    "name": {
      "title": "Token Name",
      "description": "The name of the token.",
      "stateMutability": "view",
      "group": "erc20"
    },
    "symbol": {
      "title": "Token Symbol",
      "description": "The token symbol.",
      "stateMutability": "view",
      "group": "erc20"
    },
    "decimals": {
      "title": "Decimals",
      "description": "Number of decimal places used by the token.",
      "stateMutability": "view",
      "group": "erc20"
    },
    "totalSupply": {
      "title": "Total Supply",
      "description": "Total amount of tokens in existence.",
      "stateMutability": "view",
      "group": "erc20"
    },
    "balanceOf": {
      "title": "Balance",
      "description": "Check the token balance of an address.",
      "stateMutability": "view",
      "group": "erc20",
      "params": {
        "_0": { "label": "holder", "type": "address" }
      }
    },
    "allowance": {
      "title": "Allowance",
      "description": "Check how many tokens an address has approved another address to spend.",
      "stateMutability": "view",
      "group": "erc20",
      "params": {
        "_0": { "label": "owner", "type": "address" },
        "_1": { "label": "spender", "type": "address" }
      }
    },
    "approve": {
      "title": "Approve",
      "description": "Approve a spender to transfer up to the given amount of your tokens.",
      "group": "erc20",
      "intent": "Approve {_0} to spend {_1} tokens",
      "warning": "Approving unlimited amounts is common but carries risk if the spender contract is compromised.",
      "params": {
        "_0": { "label": "spender", "type": "address" },
        "_1": { "label": "amount" }
      },
      "related": ["allowance", "transferFrom"]
    },
    "transfer": {
      "title": "Transfer",
      "description": "Transfer tokens to another address.",
      "group": "erc20",
      "intent": "Transfer {_1} tokens to {_0}",
      "params": {
        "_0": { "label": "recipient", "type": "address" },
        "_1": { "label": "amount" }
      },
      "related": ["balanceOf"]
    },
    "transferFrom": {
      "title": "Transfer From",
      "description": "Transfer tokens from one address to another, using a previously set allowance.",
      "group": "erc20",
      "params": {
        "_0": { "label": "from", "type": "address" },
        "_1": { "label": "to", "type": "address" },
        "_2": { "label": "amount" }
      },
      "related": ["approve", "allowance"]
    }
  },
  "messages": {
    "Permit": {
      "title": "Token Permit (EIP-2612)",
      "description": "Approve a spender to transfer your tokens via an off-chain signature, avoiding a separate approve transaction.",
      "warning": "This grants token spending permission. Verify the spender address and amount carefully. Phishing sites commonly request Permit signatures to drain wallets.",
      "intent": "Permit {spender} to spend {value} of your tokens until {deadline}",
      "fields": {
        "owner": { "label": "owner", "description": "The token holder granting the approval", "type": "address" },
        "spender": { "label": "spender", "description": "The address being approved to spend tokens", "type": "address" },
        "value": { "label": "amount", "description": "Maximum amount the spender can transfer" },
        "nonce": { "label": "nonce", "description": "Sequential nonce preventing signature replay" },
        "deadline": { "label": "deadline", "description": "Unix timestamp after which the permit expires", "type": "timestamp" }
      }
    }
  },
  "events": {
    "Transfer": {
      "description": "Emitted when tokens are transferred.",
      "params": {
        "from": { "label": "from" },
        "to": { "label": "to" },
        "value": { "label": "amount" }
      }
    },
    "Approval": {
      "description": "Emitted when an approval is set.",
      "params": {
        "owner": { "label": "owner" },
        "spender": { "label": "spender" },
        "value": { "label": "amount" }
      }
    }
  }
}
